{
  "id": "87d34d142c586e31817197c606e32d6c133a9d11a75a82e416ae8b927a918558",
  "source_url": "https://bagong.pagasa.dost.gov.ph/weather",
  "fetched_at": "2026-10-25T15:30:03.336Z",
  "issued_at_pst": "2026-10-25T15:30:03.336Z",
  "cyclone_name": null,
  "has_active_cyclone": true,
  "tcws_cebu": {
    "active": false,
    "signal_level": 0,
    "wind_speed_kmh": null,
    "areas_affected": []
  },
  "heavy_rainfall_alert": {
    "level": "none",
    "warning_type": null,
    "description": "No active severe rainfall warning in effect for Metro Cebu.",
    "advisory_areas": []
  },
  "storm_center": null,
  "parse_confidence": "high",
  "parse_notes": null
}
